{
  "version": "1.0.0",
  "domain": {
    "id": "H09",
    "order": 9,
    "title": "Aerobic Fitness, Endurance & Conditioning",
    "primaryLayer": "daily-practice",
    "secondaryLayers": [],
    "aliases": [
      "cardio",
      "aerobic",
      "vo2 max",
      "endurance",
      "zone 2",
      "conditioning"
    ],
    "outcome": "Explain conditioning principles and measurement limits across beginner and athletic goals.",
    "moduleIds": [
      "H09-F",
      "H09-M",
      "H09-A",
      "H09-R"
    ],
    "sourceSeedIds": [
      "health-seed-ods-performance",
      "health-seed-activity"
    ],
    "coverageGaps": [
      "Acquire topic-specific authoritative sources and qualified reviews; no scientific evidence ingested."
    ],
    "groomingDomainIds": []
  },
  "modules": [
    {
      "id": "H09-F",
      "domainId": "H09",
      "level": "Foundation",
      "title": "Aerobic Fitness, Endurance & Conditioning — Foundation",
      "prerequisiteModuleIds": [
        "H01-F"
      ],
      "topicIds": [
        "H09-F-01",
        "H09-F-02",
        "H09-F-03",
        "H09-F-04",
        "H09-F-05",
        "H09-F-06",
        "H09-F-07",
        "H09-F-08"
      ],
      "assessment": "Define the concepts, distinguish common misconceptions and identify what requires clinical evaluation.",
      "completionGate": "Topic dossiers appraised; domain and evidence reviewers accept the case assessment; clinical reviewer accepts scope and health claims."
    },
    {
      "id": "H09-M",
      "domainId": "H09",
      "level": "Mastery",
      "title": "Aerobic Fitness, Endurance & Conditioning — Mastery",
      "prerequisiteModuleIds": [
        "H09-F"
      ],
      "topicIds": [
        "H09-M-01",
        "H09-M-02",
        "H09-M-03",
        "H09-M-04",
        "H09-M-05",
        "H09-M-06",
        "H09-M-07",
        "H09-M-08"
      ],
      "assessment": "Compare practical questions and options using applicable reviewed evidence; include uncertainty and accessibility.",
      "completionGate": "Topic dossiers appraised; domain and evidence reviewers accept the case assessment; clinical reviewer accepts scope and health claims."
    },
    {
      "id": "H09-A",
      "domainId": "H09",
      "level": "Advanced",
      "title": "Aerobic Fitness, Endurance & Conditioning — Advanced",
      "prerequisiteModuleIds": [
        "H09-M"
      ],
      "topicIds": [
        "H09-A-01",
        "H09-A-02",
        "H09-A-03",
        "H09-A-04",
        "H09-A-05",
        "H09-A-06",
        "H09-A-07",
        "H09-A-08"
      ],
      "assessment": "Critique a claim dossier for study design, effect size, harms, applicability and clinical scope.",
      "completionGate": "Topic dossiers appraised; domain and evidence reviewers accept the case assessment; clinical reviewer accepts scope and health claims."
    },
    {
      "id": "H09-R",
      "domainId": "H09",
      "level": "Frontier",
      "title": "Aerobic Fitness, Endurance & Conditioning — Frontier",
      "prerequisiteModuleIds": [
        "H09-A"
      ],
      "topicIds": [
        "H09-R-01",
        "H09-R-02",
        "H09-R-03",
        "H09-R-04",
        "H09-R-05",
        "H09-R-06",
        "H09-R-07",
        "H09-R-08"
      ],
      "assessment": "Map human versus preclinical evidence, regulatory status and unanswered safety questions; do not produce a self-treatment protocol.",
      "completionGate": "Topic dossiers appraised; domain and evidence reviewers accept the case assessment; clinical reviewer accepts scope and health claims."
    }
  ],
  "topics": [
    {
      "id": "H09-F-01",
      "domainId": "H09",
      "moduleId": "H09-F",
      "level": "Foundation",
      "title": "Aerobic and anaerobic energy systems",
      "researchQuestions": [
        "What definitions and physiological concepts explain aerobic and anaerobic energy systems, and which misconception should be corrected?",
        "What population, life stage, condition, intervention identity, route, exposure, duration and meaningful outcome does each source actually address?",
        "What contraindications, interactions, access constraints, regulatory changes and professional-review requirements must be recorded?"
      ],
      "deliverables": [
        "Definitions and misconception notes",
        "Atomic claim table with exact citations, harms, uncertainty and applicability",
        "One health-education or care-navigation case with justified abstention"
      ],
      "prerequisiteModuleIds": [
        "H01-F"
      ],
      "relatedDomainIds": [
        "H01"
      ],
      "sourceSeedIds": [
        "health-seed-ods-performance",
        "health-seed-activity"
      ],
      "workflowState": "PLANNED",
      "evidenceState": "UNASSESSED",
      "provenanceStatus": "EDITORIAL",
      "reviewedAt": null,
      "reviewer": null,
      "claimIds": [],
      "answerEligible": false,
      "scope": "HEALTH_EDUCATION",
      "riskClass": "GENERAL",
      "reviewRoles": [
        "domain-specialist",
        "evidence-reviewer",
        "clinical-reviewer"
      ]
    },
    {
      "id": "H09-F-02",
      "domainId": "H09",
      "moduleId": "H09-F",
      "level": "Foundation",
      "title": "Heart rate breathing and perceived effort",
      "researchQuestions": [
        "What definitions and physiological concepts explain heart rate breathing and perceived effort, and which misconception should be corrected?",
        "What population, life stage, condition, intervention identity, route, exposure, duration and meaningful outcome does each source actually address?",
        "What contraindications, interactions, access constraints, regulatory changes and professional-review requirements must be recorded?"
      ],
      "deliverables": [
        "Definitions and misconception notes",
        "Atomic claim table with exact citations, harms, uncertainty and applicability",
        "One health-education or care-navigation case with justified abstention"
      ],
      "prerequisiteModuleIds": [
        "H01-F"
      ],
      "relatedDomainIds": [
        "H01"
      ],
      "sourceSeedIds": [
        "health-seed-ods-performance",
        "health-seed-activity"
      ],
      "workflowState": "PLANNED",
      "evidenceState": "UNASSESSED",
      "provenanceStatus": "EDITORIAL",
      "reviewedAt": null,
      "reviewer": null,
      "claimIds": [],
      "answerEligible": false,
      "scope": "HEALTH_EDUCATION",
      "riskClass": "GENERAL",
      "reviewRoles": [
        "domain-specialist",
        "evidence-reviewer",
        "clinical-reviewer"
      ]
    },
    {
      "id": "H09-F-03",
      "domainId": "H09",
      "moduleId": "H09-F",
      "level": "Foundation",
      "title": "Walking cycling swimming and running",
      "researchQuestions": [
        "What definitions and physiological concepts explain walking cycling swimming and running, and which misconception should be corrected?",
        "What population, life stage, condition, intervention identity, route, exposure, duration and meaningful outcome does each source actually address?",
        "What contraindications, interactions, access constraints, regulatory changes and professional-review requirements must be recorded?"
      ],
      "deliverables": [
        "Definitions and misconception notes",
        "Atomic claim table with exact citations, harms, uncertainty and applicability",
        "One health-education or care-navigation case with justified abstention"
      ],
      "prerequisiteModuleIds": [
        "H01-F"
      ],
      "relatedDomainIds": [
        "H01"
      ],
      "sourceSeedIds": [
        "health-seed-ods-performance",
        "health-seed-activity"
      ],
      "workflowState": "PLANNED",
      "evidenceState": "UNASSESSED",
      "provenanceStatus": "EDITORIAL",
      "reviewedAt": null,
      "reviewer": null,
      "claimIds": [],
      "answerEligible": false,
      "scope": "HEALTH_EDUCATION",
      "riskClass": "GENERAL",
      "reviewRoles": [
        "domain-specialist",
        "evidence-reviewer",
        "clinical-reviewer"
      ]
    },
    {
      "id": "H09-F-04",
      "domainId": "H09",
      "moduleId": "H09-F",
      "level": "Foundation",
      "title": "Training frequency duration and intensity",
      "researchQuestions": [
        "What definitions and physiological concepts explain training frequency duration and intensity, and which misconception should be corrected?",
        "What population, life stage, condition, intervention identity, route, exposure, duration and meaningful outcome does each source actually address?",
        "What contraindications, interactions, access constraints, regulatory changes and professional-review requirements must be recorded?"
      ],
      "deliverables": [
        "Definitions and misconception notes",
        "Atomic claim table with exact citations, harms, uncertainty and applicability",
        "One health-education or care-navigation case with justified abstention"
      ],
      "prerequisiteModuleIds": [
        "H01-F"
      ],
      "relatedDomainIds": [
        "H01"
      ],
      "sourceSeedIds": [
        "health-seed-ods-performance",
        "health-seed-activity"
      ],
      "workflowState": "PLANNED",
      "evidenceState": "UNASSESSED",
      "provenanceStatus": "EDITORIAL",
      "reviewedAt": null,
      "reviewer": null,
      "claimIds": [],
      "answerEligible": false,
      "scope": "HEALTH_EDUCATION",
      "riskClass": "GENERAL",
      "reviewRoles": [
        "domain-specialist",
        "evidence-reviewer",
        "clinical-reviewer"
      ]
    },
    {
      "id": "H09-F-05",
      "domainId": "H09",
      "moduleId": "H09-F",
      "level": "Foundation",
      "title": "Warm-up and gradual progression",
      "researchQuestions": [